<?xml version="1.0" encoding="UTF-8"?>
<!-- edited with XML Spy v4.0 U (http://www.xmlspy.com) by Thomas Novellino Version 4.0 (Hewlett Packard Co.) -->
<!--Sample XML file generated by XML Spy v4.0 U (http://www.xmlspy.com)-->
<coordination-type xmlns:xsi="http://www.w3.org/2001/XMLSchema-instance" xsi:noNamespaceSchemaLocation="C:\Documents and Settings\mlittle\Desktop\standards work\WS architecture\WSCF\0.8.2\xml\WSCF.xsd">
	<coordinator-type>urn:generic:tx-two-phase-commit</coordinator-type>
	<generic>true</generic>
	<notification>
		<name>BeforeCompletion</name>
	</notification>
	<notification>
		<name>AfterCompletion</name>
	</notification>
	<notification>
		<name>ForgetHeuristic</name>
	</notification>
	<notification>
		<name>NestedCancel</name>
		<response>
			<name>CoordinationOutcome</name>
		</response>
	</notification>
	<notification>
		<name>NestedConfirm</name>
		<response>
			<name>CoordinationOutcome</name>
		</response>
	</notification>
	<notification>
		<name>NestedOnePhaseCommit</name>
		<response>
			<name>CoordinationOutcome</name>
		</response>
	</notification>
	<notification>
		<name>NestedPrepare</name>
		<response>
			<name>VoteCancel</name>
			<name>VoteConfirm</name>
			<name>VoteReadOnly</name>
		</response>
	</notification>
	<notification>
		<name>TopLevelCancel</name>
		<response>
			<name>CoordinationOutcome</name>
		</response>
	</notification>
	<notification>
		<name>TopLevelConfirm</name>
		<response>
			<name>CoordinationOutcome</name>
		</response>
	</notification>
	<notification>
		<name>TopLevelOnePhaseCommit</name>
		<response>
			<name>CoordinationOutcome</name>
		</response>
	</notification>
	<notification>
		<name>NestedPrepare</name>
		<response>
			<name>VoteCancel</name>
			<name>VoteConfirm</name>
			<name>VoteReadOnly</name>
		</response>
	</notification>
</coordination-type>
