<?xml version="1.0" encoding="UTF-8"?>
<!-- edited with XML Spy v4.0 U (http://www.xmlspy.com) by Thomas Novellino Version 4.0 (Hewlett Packard Co.) -->
<!--Sample XML file generated by XML Spy v4.0 U (http://www.xmlspy.com)-->
<coordination-type xmlns:xsi="http://www.w3.org/2001/XMLSchema-instance" xsi:noNamespaceSchemaLocation="C:\Documents and Settings\mlittle\Desktop\standards work\WS architecture\WSCF\0.8.2\xml\WSCF.xsd">
	<coordinator-type>urn:generic:tx-jta</coordinator-type>
	<notification>
		<name>XACommit</name>
	</notification>
	<notification>
		<name>XAStart</name>
	</notification>
	<notification>
		<name>XAEnd</name>
	</notification>
	<notification>
		<name>XAForget</name>
	</notification>
	<notification>
		<name>XAPrepare</name>
		<response>
			<name>XAOutcome</name>
		</response>
	</notification>
	<notification>
		<name>XARecover</name>
		<response>
			<name>XIDList</name>
		</response>
	</notification>
</coordination-type>
