<?xml version="1.0" encoding="UTF-8"?>
<!-- edited with XML Spy v4.0 U (http://www.xmlspy.com) by Thomas Novellino Version 4.0 (Hewlett Packard Co.) -->
<!--Sample XML file generated by XML Spy v4.0 U (http://www.xmlspy.com)-->
<coordination-type xmlns:xsi="http://www.w3.org/2001/XMLSchema-instance" xsi:noNamespaceSchemaLocation="C:\Documents and Settings\mlittle\Desktop\standards work\WS architecture\WSCF\0.8.2\xml\WSCF.xsd">
	<coordinator-type>urn:two-phase</coordinator-type>
	<notification>
		<name>prepare</name>
		<response>
			<name>confirm</name>
			<name>cancel</name>
			<name>readonly</name>
		</response>
	</notification>
	<notification>
		<name>confirm</name>
		<response>
			<name>confirmed</name>
			<name>cancelled</name>
		</response>
	</notification>
	<notification>
		<name>cancel</name>
		<response>
			<name>cancelled</name>
			<name>confirmed</name>
		</response>
	</notification>
</coordination-type>
